{
  "schemaVersion": 1,
  "generatedAt": "manual-pinned",
  "source": {
    "kind": "excel",
    "version": "unknown",
    "build": "unknown",
    "operatingSystem": "unknown",
    "note": "Synthetic CI baseline (not generated by Excel). Regenerate with tools/excel-oracle/run-excel-oracle.ps1 on Windows + Excel and pin via tools/excel-oracle/pin_dataset.py."
  },
  "caseSet": {
    "path": "tests/compatibility/excel-oracle/cases.json",
    "sha256": "e8bfcab0a0113829c840b2c9461b33dd33b996340a9b88a232c1405a7c77ddf7",
    "count": 400
  },
  "results": [
    {
      "caseId": "arith_add_96a86e5f7a22",
      "outputCell": "C1",
      "result": {
        "t": "n",
        "v": 0.0
      },
      "address": "C1",
      "displayText": "0"
    },
    {
      "caseId": "arith_add_5234b05a3369",
      "outputCell": "C1",
      "result": {
        "t": "n",
        "v": 1.0
      },
      "address": "C1",
      "displayText": "1"
    },
    {
      "caseId": "arith_add_fe945ac67aa3",
      "outputCell": "C1",
      "result": {
        "t": "n",
        "v": -1.0
      },
      "address": "C1",
      "displayText": "-1"
    },
    {
      "caseId": "arith_add_160101d86064",
      "outputCell": "C1",
      "result": {
        "t": "n",
        "v": 2.0
      },
      "address": "C1",
      "displayText": "2"
    },
    {
      "caseId": "arith_add_90641ef45bce",
      "outputCell": "C1",
      "result": {
        "t": "n",
        "v": -2.0
      },
      "address": "C1",
      "displayText": "-2"
    },
    {
      "caseId": "arith_add_626f6a6021df",
      "outputCell": "C1",
      "result": {
        "t": "n",
        "v": 0.5
      },
      "address": "C1",
      "displayText": "0.5"
    },
    {
      "caseId": "arith_add_3182aedfe3f5",
      "outputCell": "C1",
      "result": {
        "t": "n",
        "v": 10.0
      },
      "address": "C1",
      "displayText": "10"
    },
    {
      "caseId": "arith_add_90dd8a696842",
      "outputCell": "C1",
      "result": {
        "t": "n",
        "v": -10.0
      },
      "address": "C1",
      "displayText": "-10"
    },
    {
      "caseId": "arith_add_622f42731a70",
      "outputCell": "C1",
      "result": {
        "t": "n",
        "v": 1.0
      },
      "address": "C1",
      "displayText": "1"
    },
    {
      "caseId": "arith_add_8093bf371bef",
      "outputCell": "C1",
      "result": {
        "t": "n",
        "v": 2.0
      },
      "address": "C1",
      "displayText": "2"
    },
    {
      "caseId": "arith_add_fd8617c6d47d",
      "outputCell": "C1",
      "result": {
        "t": "n",
        "v": 0.0
      },
      "address": "C1",
      "displayText": "0"
    },
    {
      "caseId": "arith_add_d59732e4438f",
      "outputCell": "C1",
      "result": {
        "t": "n",
        "v": 3.0
      },
      "address": "C1",
      "displayText": "3"
    },
    {
      "caseId": "arith_add_e0e1f251baa3",
      "outputCell": "C1",
      "result": {
        "t": "n",
        "v": -1.0
      },
      "address": "C1",
      "displayText": "-1"
    },
    {
      "caseId": "arith_add_1cdf4b07e420",
      "outputCell": "C1",
      "result": {
        "t": "n",
        "v": 1.5
      },
      "address": "C1",
      "displayText": "1.5"
    },
    {
      "caseId": "arith_add_684123a1ab7e",
      "outputCell": "C1",
      "result": {
        "t": "n",
        "v": 11.0
      },
      "address": "C1",
      "displayText": "11"
    },
    {
      "caseId": "arith_add_14b6c4898aa0",
      "outputCell": "C1",
      "result": {
        "t": "n",
        "v": -9.0
      },
      "address": "C1",
      "displayText": "-9"
    },
    {
      "caseId": "arith_add_12fd733e6ddd",
      "outputCell": "C1",
      "result": {
        "t": "n",
        "v": -1.0
      },
      "address": "C1",
      "displayText": "-1"
    },
    {
      "caseId": "arith_add_a23ccbd33f8d",
      "outputCell": "C1",
      "result": {
        "t": "n",
        "v": 0.0
      },
      "address": "C1",
      "displayText": "0"
    },
    {
      "caseId": "arith_add_7b35a0b663f2",
      "outputCell": "C1",
      "result": {
        "t": "n",
        "v": -2.0
      },
      "address": "C1",
      "displayText": "-2"
    },
    {
      "caseId": "arith_add_861a36a926bc",
      "outputCell": "C1",
      "result": {
        "t": "n",
        "v": 1.0
      },
      "address": "C1",
      "displayText": "1"
    },
    {
      "caseId": "arith_add_58a12c15fe4a",
      "outputCell": "C1",
      "result": {
        "t": "n",
        "v": -3.0
      },
      "address": "C1",
      "displayText": "-3"
    },
    {
      "caseId": "arith_add_94e202982b7e",
      "outputCell": "C1",
      "result": {
        "t": "n",
        "v": -0.5
      },
      "address": "C1",
      "displayText": "-0.5"
    },
    {
      "caseId": "arith_add_fb4a46670de0",
      "outputCell": "C1",
      "result": {
        "t": "n",
        "v": 9.0
      },
      "address": "C1",
      "displayText": "9"
    },
    {
      "caseId": "arith_add_cffedec3b79e",
      "outputCell": "C1",
      "result": {
        "t": "n",
        "v": -11.0
      },
      "address": "C1",
      "displayText": "-11"
    },
    {
      "caseId": "arith_add_2c5c7170dda1",
      "outputCell": "C1",
      "result": {
        "t": "n",
        "v": 2.0
      },
      "address": "C1",
      "displayText": "2"
    },
    {
      "caseId": "arith_add_04c05b43c5d0",
      "outputCell": "C1",
      "result": {
        "t": "n",
        "v": 3.0
      },
      "address": "C1",
      "displayText": "3"
    },
    {
      "caseId": "arith_add_82bb03d5e30b",
      "outputCell": "C1",
      "result": {
        "t": "n",
        "v": 1.0
      },
      "address": "C1",
      "displayText": "1"
    },
    {
      "caseId": "arith_add_6a87ee31c74e",
      "outputCell": "C1",
      "result": {
        "t": "n",
        "v": 4.0
      },
      "address": "C1",
      "displayText": "4"
    },
    {
      "caseId": "arith_add_b90606e372d1",
      "outputCell": "C1",
      "result": {
        "t": "n",
        "v": 0.0
      },
      "address": "C1",
      "displayText": "0"
    },
    {
      "caseId": "arith_add_9e77362ee2de",
      "outputCell": "C1",
      "result": {
        "t": "n",
        "v": 2.5
      },
      "address": "C1",
      "displayText": "2.5"
    },
    {
      "caseId": "arith_add_f288b0efdf8c",
      "outputCell": "C1",
      "result": {
        "t": "n",
        "v": 12.0
      },
      "address": "C1",
      "displayText": "12"
    },
    {
      "caseId": "arith_add_30645c71c007",
      "outputCell": "C1",
      "result": {
        "t": "n",
        "v": -8.0
      },
      "address": "C1",
      "displayText": "-8"
    },
    {
      "caseId": "arith_add_cf56a6c213b6",
      "outputCell": "C1",
      "result": {
        "t": "n",
        "v": -2.0
      },
      "address": "C1",
      "displayText": "-2"
    },
    {
      "caseId": "arith_add_1aa3f5e54bd4",
      "outputCell": "C1",
      "result": {
        "t": "n",
        "v": -1.0
      },
      "address": "C1",
      "displayText": "-1"
    },
    {
      "caseId": "arith_add_c383ce9a41a4",
      "outputCell": "C1",
      "result": {
        "t": "n",
        "v": -3.0
      },
      "address": "C1",
      "displayText": "-3"
    },
    {
      "caseId": "arith_add_00ef986d0dcb",
      "outputCell": "C1",
      "result": {
        "t": "n",
        "v": 0.0
      },
      "address": "C1",
      "displayText": "0"
    },
    {
      "caseId": "arith_add_7d1b1bb402c3",
      "outputCell": "C1",
      "result": {
        "t": "n",
        "v": -4.0
      },
      "address": "C1",
      "displayText": "-4"
    },
    {
      "caseId": "arith_add_cd70c5e294b9",
      "outputCell": "C1",
      "result": {
        "t": "n",
        "v": -1.5
      },
      "address": "C1",
      "displayText": "-1.5"
    },
    {
      "caseId": "arith_add_3ae5fc5ce8ab",
      "outputCell": "C1",
      "result": {
        "t": "n",
        "v": 8.0
      },
      "address": "C1",
      "displayText": "8"
    },
    {
      "caseId": "arith_add_a7b634c0b93b",
      "outputCell": "C1",
      "result": {
        "t": "n",
        "v": -12.0
      },
      "address": "C1",
      "displayText": "-12"
    },
    {
      "caseId": "arith_add_0eb43939b81a",
      "outputCell": "C1",
      "result": {
        "t": "n",
        "v": 0.5
      },
      "address": "C1",
      "displayText": "0.5"
    },
    {
      "caseId": "arith_add_ec8d13a53ed5",
      "outputCell": "C1",
      "result": {
        "t": "n",
        "v": 1.5
      },
      "address": "C1",
      "displayText": "1.5"
    },
    {
      "caseId": "arith_add_b95dafc64464",
      "outputCell": "C1",
      "result": {
        "t": "n",
        "v": -0.5
      },
      "address": "C1",
      "displayText": "-0.5"
    },
    {
      "caseId": "arith_add_249b1b85e99a",
      "outputCell": "C1",
      "result": {
        "t": "n",
        "v": 2.5
      },
      "address": "C1",
      "displayText": "2.5"
    },
    {
      "caseId": "arith_add_04c9dfdc79a0",
      "outputCell": "C1",
      "result": {
        "t": "n",
        "v": -1.5
      },
      "address": "C1",
      "displayText": "-1.5"
    },
    {
      "caseId": "arith_add_6541dc22bdc7",
      "outputCell": "C1",
      "result": {
        "t": "n",
        "v": 1.0
      },
      "address": "C1",
      "displayText": "1"
    },
    {
      "caseId": "arith_add_8699d0ad05ad",
      "outputCell": "C1",
      "result": {
        "t": "n",
        "v": 10.5
      },
      "address": "C1",
      "displayText": "10.5"
    },
    {
      "caseId": "arith_add_3e623a8ba4a8",
      "outputCell": "C1",
      "result": {
        "t": "n",
        "v": -9.5
      },
      "address": "C1",
      "displayText": "-9.5"
    },
    {
      "caseId": "arith_add_4dec7c41844b",
      "outputCell": "C1",
      "result": {
        "t": "n",
        "v": 10.0
      },
      "address": "C1",
      "displayText": "10"
    },